<?xml version="1.0" encoding="UTF-8"?>

<?xml-model href="SSTDataDescription.xsd" type="application/xml" schematypens="http://purl.oclc.org/dsdl/schematron"?>

<!--     
                       SST Data Description. 

Type      = SubIntegration (RF,fast) and Integration (RS, integrated)
Time Span = 1900-01-01 to 1999-05-01
Origin    = IDL sst_struct.pro, version 2017-07-29, lines: 216-224
Structure = (from IDL)

            nradiom = 6
            nchan   = 8
            raw_struc={n_struc,
                       time:0l, 
                       adcval:     intarr(nchan)   ,$ 
                       pos_time:   0l              ,$
                       azipos:     0l              ,$ 
                       elepos:     0l              ,$ 
                       azivel:     0               ,$ 
                       elevel:     0               ,$ 
                       azierr:     0l              ,$
                       eleerr:     0l              ,$ 
                       att:        intarr(nradiom) ,$
                       target:     0b              ,$ 
                       opmode:     0b              ,$ 
                       gps_status: 0               ,$ 
                       daq_status: 0               ,$ 
                       recnum:     0l              }
      
-->

<SSTDataFormat 
    DataType="Data"
    InitialDate="1900-01-01"
    FinalDate="1999-05-01"
    IDLReference="sst_struc.pro:216-224"
    xmlns:xsi="http://www.w3.org/2001/XMLSchema-instance"
    xsi:noNamespaceSchemaLocation="SSTDataDescription.xsd">
    
    <SSTDataVariable VarName="time">
        <VarName>time</VarName>
        <VarLength>1</VarLength>
        <VarType>xs:int</VarType>
        <VarUnit>Hus</VarUnit>
    </SSTDataVariable>
    
    <SSTDataVariable VarName="adcval">
        <VarName>adcval</VarName>
        <VarLength>8</VarLength>
        <VarType>xs:short</VarType>
        <VarUnit>ADCu</VarUnit>
    </SSTDataVariable>
    
    <SSTDataVariable VarName="pos_time">
        <VarName>pos_time</VarName>
        <VarLength>1</VarLength>
        <VarType>xs:int</VarType>
        <VarUnit>Hus</VarUnit>
    </SSTDataVariable>
    
    <SSTDataVariable VarName="azipos">
        <VarName>azipos</VarName>
        <VarLength>1</VarLength>
        <VarType>xs:int</VarType>
        <VarUnit>mDeg</VarUnit>
    </SSTDataVariable>
    
    <SSTDataVariable VarName="elepos">
        <VarName>elepos</VarName>
        <VarLength>1</VarLength>
        <VarType>xs:int</VarType>
        <VarUnit>mDeg</VarUnit>
    </SSTDataVariable>
    
    <SSTDataVariable VarName="azivel">
        <VarName>azivel</VarName>
        <VarLength>1</VarLength>
        <VarType>xs:short</VarType>
        <VarUnit>mDeg/s</VarUnit>
    </SSTDataVariable>
    
    <SSTDataVariable VarName="elevel">
        <VarName>elevel</VarName>
        <VarLength>1</VarLength>
        <VarType>xs:short</VarType>
        <VarUnit>mDeg/s</VarUnit>
    </SSTDataVariable>
    
    <SSTDataVariable VarName="azierr">
        <VarName>azierr</VarName>
        <VarLength>1</VarLength>
        <VarType>xs:int</VarType>
        <VarUnit>mDeg</VarUnit>
    </SSTDataVariable>
    
    <SSTDataVariable VarName="eleerr">
        <VarName>eleerr</VarName>
        <VarLength>1</VarLength>
        <VarType>xs:int</VarType>
        <VarUnit>mDeg</VarUnit>
    </SSTDataVariable>
        
    <SSTDataVariable VarName="att">
        <VarName>att</VarName>
        <VarLength>6</VarLength>
        <VarType>xs:short</VarType>
        <VarUnit>dB</VarUnit>
    </SSTDataVariable>
    
    <SSTDataVariable VarName="target">
        <VarName>target</VarName>
        <VarLength>1</VarLength>
        <VarType>xs:byte</VarType>
        <VarUnit>none</VarUnit>
    </SSTDataVariable>
    
    <SSTDataVariable VarName="opmode">
        <VarName>opmode</VarName>
        <VarLength>1</VarLength>
        <VarType>xs:byte</VarType>
        <VarUnit>none</VarUnit>
    </SSTDataVariable>
    
    <SSTDataVariable VarName="gps_status">
        <VarName>gps_status</VarName>
        <VarLength>1</VarLength>
        <VarType>xs:short</VarType>
        <VarUnit>none</VarUnit>
    </SSTDataVariable>
    
    <SSTDataVariable VarName="daq_status">
        <VarName>daq_status</VarName>
        <VarLength>1</VarLength>
        <VarType>xs:short</VarType>
        <VarUnit>none</VarUnit>
    </SSTDataVariable>
    
    <SSTDataVariable VarName="recnum">
        <VarName>recnum</VarName>
        <VarLength>1</VarLength>
        <VarType>xs:int</VarType>
        <VarUnit>none</VarUnit>
    </SSTDataVariable>
    
</SSTDataFormat>
